<?xml version="1.0" encoding="UTF-8"?>
<!--
    Document   : histogram.xml
    Created on : 20 July 2007, 16:10
    Author     : nxi
    Description:
        Recipe file of taking a data out from the databag in the wombat algorithm set.
-->
<framework xmlns="http://www.ansto.gov.au/bragg/dra/recipeSchema" 
xmlns:xsi="http://www.w3.org/2001/XMLSchema-instance" 
xsi:schemaLocation="http://www.ansto.gov.au/bragg/dra/recipeSchema http://gumtree.ansto.gov.au:9080/nbicms/dat-projects/data-reduction-capability-projects/cicada-the-dav-application-interface-project/xml-schema/recipe.xsd"
id="250801" 
name="Histogram Data" 
domain="au.gov.ansto.bragg.wombat.dra" 
version="1.0" 
help_url="./help.txt" 
short_description="Realtime histogram data" 
icon="xml/icons/findData.gif"
hidden="false">

	<processor name="HistogramViewer" class="au.gov.ansto.bragg.nbi.dra.experiment.HistogramViewer">
		<ins>
			<in name="histogramViewer_loopIn" type="java.lang.Boolean"/>
		</ins>
		<outs>
			<out name="histogramViewer_data" type="org.gumtree.data.gdm.core.Group"/>
			<out name="histogramViewer_loopOut" type="java.lang.Boolean"/>
		</outs>
		<vars>
			<var name="histogramViewer_host" type="java.lang.String"/>
			<var name="histogramViewer_port" type="java.lang.Integer"/>
			<var name="histogramViewer_interval" type="java.lang.Double"/>
			<var name="histogramViewer_stop" type="java.lang.Boolean"/>
		</vars>
	</processor>
	<processor name="Source" class="au.gov.ansto.bragg.wombat.dra.core.FindData">
		<ins>
			<in name="source_groupData" type="org.gumtree.data.gdm.core.Group"/>
		</ins>
		<outs>
			<out name="source_scanData" type="org.gumtree.data.gdm.core.Group"/>
		</outs>
		<vars>
			<var name="source_dataName" type="java.lang.String"/>
		</vars>
	</processor>
	<processor name="VerticalIntegration" class="au.gov.ansto.bragg.nbi.dra.core.VerticalIntegration" version="1.0.0">
		<ins>
			<in name="verticalIntegration_input" type="org.gumtree.data.gdm.core.Group"/>
		</ins>
		<outs>
			<out name="verticalIntegration_output" type="org.gumtree.data.gdm.core.Group"/>
		</outs>
		<vars>
			<var name="verticalIntegration_region" type="org.gumtree.data.gdm.core.Group"/>
			<var name="vertInt_scale" type="java.lang.Boolean"/>
		</vars>
	</processor>
	<sink name="SourceSink">
		<ins>
			<in name="sourceSink_in" type="org.gumtree.data.gdm.core.Group"/>
		</ins>
	</sink>
	<sink name="verticalIntegration_result">
		<ins>
			<in name="verticalIntegrationResult_in" type="org.gumtree.data.gdm.core.Group"/>
		</ins>
	</sink>
	<vars>
		<var name="frame_host" type="java.lang.String" default_value="das1-wombat.nbi.ansto.gov.au" option="das1-wombat.nbi.ansto.gov.au,localhost,default" label="histogram server"/>
		<var name="frame_port" type="java.lang.Integer" default_value="8080" option="8080,8081" label="server port"/>
		<var name="frame_interval" type="java.lang.Double" default_value="30.0" label="Refresh Interval"/>
		<var name="frame_histogramViewerStop" type="java.lang.Boolean" default_value="false" label="stop refreshing"/>
		<var name="frame_dataName" type="java.lang.String" default_value="data" label="name of data"/>
		<var name="frame_verticalIntegrationRegion" type="org.gumtree.data.gdm.core.Group" default_value="null" usage="region" label="region of interests or mask"/>
	    <var name="frame_rescale" type="java.lang.Boolean" default_value="false" usage="parameter" label="Make maximum=10000"/>
	</vars>
	<connectors>
		<connector producer="frame_host" consumer="histogramViewer_host"/>
		<connector producer="frame_port" consumer="histogramViewer_port"/>
		<connector producer="frame_interval" consumer="histogramViewer_interval"/>
		<connector producer="frame_histogramViewerStop" consumer="histogramViewer_stop"/>
		<connector producer="frame_dataName" consumer="source_dataName"/>
		<connector producer="frame_verticalIntegrationRegion" consumer="verticalIntegration_region"/>
		<connector producer="frame_rescale" consumer="vertInt_scale"/>
		<connector producer="histogramViewer_data" consumer="source_groupData"/>
		<connector producer="histogramViewer_loopOut" consumer="histogramViewer_loopIn"/>
		<connector producer="source_scanData" consumer="sourceSink_in"/>
		<connector producer="source_scanData" consumer="verticalIntegration_input"/>
		<connector producer="verticalIntegration_output" consumer="verticalIntegrationResult_in"/>
	</connectors>
	<agents>
		<agent name="histogram_processor" principal="ProcessorAgent" pname="HistogramViewer" label="Histogram Viewer"/>
		<agent name="source_processor" principal="ProcessorAgent" pname="Source" label="Data Source"/>
		<agent name="integration_processor" principal="ProcessorAgent" pname="VerticalIntegration" label="Integration"/>
	</agents>
</framework>
